<?xml version="1.0" encoding="UTF-8"?>
<!DOCTYPE unit-definition SYSTEM "unit.dtd">

<unit-definition>
	<unit name="EA Epimetheus Jump Cruiser" model="Epsilon Model" hull="Epimetheus" version="2" author="RLB" source="EW">			
		<specs type="Capital Ship" pointValue="560" rammingFactor="220" />
		<maneuvering turnCost="1" turnDelay="1" accelDecelCost="2" pivotCost="2+2" rollCost="2+2" /> 		
		<combat-stats fwdAftDefense="14" stbPortDefense="15" initiativeModifier="0" />
		<service-history>
			<period-of-service faction="EA" inService="2193" availability="Base" deployment="Unlimited" />
		</service-history>
		<!-- <unreliabilities>
			<unreliability name="Power Fluctuations" />
		</unreliabilities> -->
		<traits>
			<trait name="Unreliable Ship" value="Power Fluctuations" />
		</traits>	
		
		<ship-definition>	
			<hit-location-charts>		
				<hit-location-chart name="FORWARD HITS">	 	
					<hit-location class="SystemHitLocation" from="1" to="5">
						<property name="systemType" value="Thruster" />
					</hit-location>
					<hit-location class="SystemHitLocation" from="6" to="7">
						<property name="systemType" value="Particle Cannon" />
					</hit-location>
					<hit-location class="SystemHitLocation" from="8" to="10">
						<property name="systemType" value="Interceptor Mk-I" />
					</hit-location>
					<hit-location class="SystemHitLocation" from="11" to="18">
						<property name="systemType" value="Structure" />
					</hit-location>
					<hit-location class="SectionHitLocation" from="19" to="20">
						<property name="sectionName" value="PRIMARY" />
					</hit-location>
				</hit-location-chart>
				
				<hit-location-chart name="SIDE HITS">	 	
					<hit-location class="SystemHitLocation" from="1" to="4">
						<property name="systemType" value="Thruster" />
					</hit-location>
					<hit-location class="SystemHitLocation" from="5" to="6">
						<property name="systemType" value="Medium Plasma Cannon" />
					</hit-location>
					<hit-location class="SystemHitLocation" from="7" to="10">
						<property name="systemType" value="Railgun" />
					</hit-location>
					<hit-location class="SystemHitLocation" from="11" to="18">
						<property name="systemType" value="Structure" />
					</hit-location>
					<hit-location class="SectionHitLocation" from="19" to="20">
						<property name="sectionName" value="PRIMARY" />
					</hit-location>
				</hit-location-chart>
		
				<hit-location-chart name="AFT HITS">	 	
					<hit-location class="SystemHitLocation" from="1" to="6">
						<property name="systemType" value="Thruster" />
					</hit-location>
					<hit-location class="SystemHitLocation" from="7" to="8">
						<property name="systemType" value="Medium Plasma Cannon" />
					</hit-location>
					<hit-location class="SystemHitLocation" from="9" to="9">
						<property name="systemType" value="Interceptor Mk-I" />
					</hit-location>
					<hit-location class="SystemHitLocation" from="10" to="12">
						<property name="systemType" value="Jump Engine" />
					</hit-location>
					<hit-location class="SystemHitLocation" from="13" to="18">
						<property name="systemType" value="Structure" />
					</hit-location>
					<hit-location class="SectionHitLocation" from="19" to="20">
						<property name="sectionName" value="PRIMARY" />
					</hit-location>
				</hit-location-chart>
		
				<hit-location-chart name="PRIMARY HITS">			
					<hit-location class="SystemHitLocation" from="1" to="10">
						<property name="systemType" value="Structure" />
					</hit-location>
					<hit-location class="SystemHitLocation" from="11" to="12">
						<property name="systemType" value="Standard Particle Beam" />
					</hit-location>
					<hit-location class="SystemHitLocation" from="13" to="14">
						<property name="systemType" value="Sensors" />
					</hit-location>
					<hit-location class="SystemHitLocation" from="15" to="16">
						<property name="systemType" value="Engine" />
					</hit-location>
					<hit-location class="SystemHitLocation" from="17" to="18">
						<property name="systemType" value="Hangar" />
					</hit-location>
					<hit-location class="SystemHitLocation" from="19" to="19">
						<property name="systemType" value="Reactor" />
					</hit-location>
					<hit-location class="SystemHitLocation" from="20" to="20">
						<property name="systemType" value="C &amp; C" />
					</hit-location>
				</hit-location-chart>
			</hit-location-charts>
			
			<sections>
				<section name="FORWARD" class="StructureSection" arc="F60" hitLocationChart="FORWARD HITS">
					<systems>
						<system class="Structure" damageBoxes="50" armor="4" />
						<system class="Thruster" damageBoxes="8" armor="3" arc="F120">
							<property name="thrustRating" value="3" />
						</system>					
						<system class="Thruster" damageBoxes="8" armor="3" arc="F120">
							<property name="thrustRating" value="3" />
						</system>					
						<weapon type="Particle Cannon" armor="3" arc="F120" number="3" />					
						<weapon type="Interceptor Mk-I" armor="2" arc="FP120" number="9" />						
						<weapon type="Interceptor Mk-I" armor="2" arc="FS120" number="10" />
					</systems>
				</section>
			
				<section name="PORT" class="StructureSection" arc="P120" hitLocationChart="SIDE HITS">
					<systems>
						<system class="Structure" damageBoxes="48" armor="4" />
						<system class="Thruster" damageBoxes="13" armor="3" arc="P120">
							<property name="thrustRating" value="4" />
						</system>					
						<weapon type="Railgun" armor="4" arc="FP60" number="1" />
						<weapon type="Medium Plasma Cannon" armor="3" arc="P180" number="4" />					
					</systems>
				</section>
		
				<section name="PRIMARY" class="StructureSection" hitLocationChart="PRIMARY HITS">
					<systems>
						<system class="Structure" damageBoxes="40" armor="4" />
						<system class="CommandAndControl" damageBoxes="16" armor="4" />
						<system class="Sensors" damageBoxes="14" armor="4" power="4">
							<property name="sensorRating" value="6" />
						</system>					
						<system class="Engine" damageBoxes="11" armor="4">
							<property name="freeThrust" value="6" />
							<property name="efficiency" value="4/1" />
						</system>					
						<system class="Reactor" damageBoxes="23" armor="4">
							<property name="availablePower" value="40" />
						</system>					
						<system class="Hangar" damageBoxes="2" armor="4">
							<property name="launchRate" value="2" />
						</system>					
						<weapon type="Standard Particle Beam" armor="2" arc="360" number="7" />
						<weapon type="Standard Particle Beam" armor="2" arc="360" number="8" />
					</systems>
				</section>
		
				<section name="STARBOARD" class="StructureSection" arc="S120" hitLocationChart="SIDE HITS">
					<systems>
						<system class="Structure" damageBoxes="48" armor="4" />
						<system class="Thruster" damageBoxes="13" armor="3" arc="S120">
							<property name="thrustRating" value="4" />
						</system>					
						<weapon type="Railgun" armor="4" arc="FS60" number="2" />
						<weapon type="Medium Plasma Cannon" armor="3" arc="S180" number="5" />					
					</systems>
				</section>
			
				<section name="AFT" class="StructureSection" arc="A60" hitLocationChart="AFT HITS">
					<systems>
						<system class="Structure" damageBoxes="36" armor="3" />
						<system class="Thruster" damageBoxes="7" armor="3" arc="A120">
							<property name="thrustRating" value="2" />
						</system>					
						<system class="Thruster" damageBoxes="7" armor="3" arc="A120">
							<property name="thrustRating" value="2" />
						</system>					
						<system class="Thruster" damageBoxes="7" armor="3" arc="A120">
							<property name="thrustRating" value="2" />
						</system>
						<system class="JumpEngine" damageBoxes="20" armor="4" power="3">
							<property name="jumpDelay" value="30" />
						</system>					
						<weapon type="Medium Plasma Cannon" armor="3" arc="A120" number="6" />
						<weapon type="Interceptor Mk-I" armor="2" arc="A180" number="11" />
					</systems>
				</section>
			</sections>
		</ship-definition>						
	</unit>				
</unit-definition>				
